Topic,Exam Percentage,Study Time (minutes),Description
Linked Lists,25%,75,A data structure consisting of a sequence of nodes, each storing a reference to the next node
Binary Trees,25%,75,A tree data structure in which each node has at most two children
Graphs,15%,45,A non-linear data structure consisting of vertices and edges
Recursion,10%,30,A programming technique where a function calls itself to solve a problem
Hashing and HashTables,10%,30,A data structure that uses a hash function to efficiently store and retrieve data
Sorting Algorithms,15%,45,Algorithms used to arrange elements in a specific order